{
  "$id": "lena_video_qa_v1.schema.json", "$schema": "https://json-schema.org/draft/2020-12/schema", "type": "object", "additionalProperties": false,
  "required": ["schema_version", "artifact_type", "artifact_id", "property_id", "video_id", "governed_date", "created_at", "generator_version", "upstream_artifacts", "deterministic_checks", "semantic_visual_checks", "optional_human_review", "overall_quality", "publish_disposition", "reject_conditions"],
  "properties": {
    "schema_version": {"const": "lena_video_artifact_v1"}, "artifact_type": {"const": "lena_video_qa_v1"}, "artifact_id": {"$ref": "common_defs_v1.schema.json#/$defs/artifact_id"}, "property_id": {"const": "lena"}, "video_id": {"$ref": "common_defs_v1.schema.json#/$defs/video_id"}, "governed_date": {"$ref": "common_defs_v1.schema.json#/$defs/governed_date"}, "created_at": {"$ref": "common_defs_v1.schema.json#/$defs/created_at"}, "generator_version": {"$ref": "common_defs_v1.schema.json#/$defs/slug"}, "upstream_artifacts": {"$ref": "common_defs_v1.schema.json#/$defs/upstream_artifacts"},
    "deterministic_checks": {"type": "array", "items": {"$ref": "common_defs_v1.schema.json#/$defs/qa_check"}, "minItems": 8, "maxItems": 40}, "semantic_visual_checks": {"type": "array", "items": {"$ref": "common_defs_v1.schema.json#/$defs/qa_check"}, "minItems": 10, "maxItems": 40}, "optional_human_review": {"type": "object", "additionalProperties": false, "required": ["status", "notes"], "properties": {"status": {"enum": ["not_requested", "approved", "rejected"]}, "notes": {"type": "string", "maxLength": 2000}}}, "overall_quality": {"enum": ["not_assessable_pre_generation", "reject", "revise", "premium_pass"]}, "publish_disposition": {"enum": ["not_authorized", "reject", "hold", "approved"]}, "reject_conditions": {"$ref": "common_defs_v1.schema.json#/$defs/string_list"}
  }
}
